{
  "kind": "hardware",
  "id": "magnet-6x2",
  "name": "Round neodymium magnet 6×2 mm",
  "category": "magnet",
  "spec": {
    "odMm": 6,
    "dims": "6x2"
  },
  "packSizes": [10, 20, 50, 100],
  "aliases": ["6x2 magnet", "6 x 2 mm disc magnet", "6x2 mm neodymium magnet"],
  "source": {
    "platform": "other",
    "url": "https://en.wikipedia.org/wiki/Neodymium_magnet"
  },
  "verified": {
    "by": "catalog seed",
    "date": "2026-10-11",
    "method": "page",
    "note": "Generic part: disc magnet, diameter × thickness in mm."
  }
}
