{
  "kind": "hardware",
  "id": "screw-m2-5x6-shcs",
  "name": "M2.5×6 socket head cap screw",
  "category": "screw",
  "spec": {
    "thread": "M2.5",
    "lengthMm": 6,
    "head": "shcs"
  },
  "packSizes": [10, 25, 50, 100],
  "aliases": ["M2.5x6 SHCS", "M2.5 x 6 socket head cap screw", "DIN 912 M2.5x6", "ISO 4762 M2.5x6"],
  "source": {
    "platform": "other",
    "url": "https://en.wikipedia.org/wiki/ISO_metric_screw_thread"
  },
  "verified": {
    "by": "catalog seed",
    "date": "2026-10-11",
    "method": "page",
    "note": "Standard part: ISO 4762 / DIN 912 socket head cap screw."
  }
}
